<?xml version="1.0" encoding="UTF-8"?>

<!-- New XSD document created with EditiX XML Editor (http://www.editix.com) at Thu Jan 12 11:26:23 IST 2017 -->

<xs:schema xmlns:xs="http://www.w3.org/2001/XMLSchema">

<xs:element name="Customer">
<xs:complexType>
<xs:sequence>
<xs:element ref="orders" minOccurs="1" maxOccurs="unbounded"></xs:element>
</xs:sequence>
</xs:complexType>
</xs:element>

<xs:element name="orders">
<xs:complexType>
<xs:sequence>
<xs:element ref="custid" minOccurs="0" maxOccurs="1"></xs:element>
<xs:element ref="custname" minOccurs="0" maxOccurs="1"></xs:element>
<xs:element ref="itemname" minOccurs="0" maxOccurs="1"></xs:element>
<xs:element ref="amount" minOccurs="0" maxOccurs="1"></xs:element>
</xs:sequence>
</xs:complexType>
</xs:element>

<xs:element name="custid" type="xs:string"></xs:element>
<xs:element name="custname" type="xs:string"></xs:element>
<xs:element name="itemname" type="xs:string"></xs:element>
<xs:element name="amount" type="xs:integer"></xs:element>

</xs:schema>
